video_id,url,title,channel,upload_date,duration_s,license,singer_count_est,latency_regime_label,satb_confirmed,download_sha256,ingest_date,notes,tier
93zVg7wN-Lo,https://youtu.be/93zVg7wN-Lo,London City Voices small group sings Let Your Love Flow (the Bellamy Brothers) LIVE on Jamulus/Zoom.,London City Voices Choir,20210130,215,Standard YouTube License,8,NMP-Jamulus+Zoom,unknown,pending-sprint3,2026-05-17,Experiment framing with no mention of editing; transient smearing on consonant attacks audible.,Tier-1
HUuUAOb2n8g,https://www.youtube.com/watch?v=HUuUAOb2n8g,Zoom Choir Rehearsal 5.20.2020,Rick McCollum,20200522,2438,Standard YouTube License,30,Zoom-only,unknown,pending-sprint3,2026-05-17,"yt-dlp failed: ERROR: [youtube] HUuUAOb2n8g: This video is not available | revived 2026-05-19 via yt-dlp player_client=web,android workaround",Tier-1
NCXnQAMq0pY,https://youtu.be/NCXnQAMq0pY,Gewandhaus Choir – Soundjack Online Rehearsal Recoding 2 (12.2.21),Alexander Carôt,20210213,45,Standard YouTube License,16,NMP-SoundJack,unknown,pending-sprint3,2026-05-17,Start-stop rehearsal mechanics and raw UDP transmission glitches visible in the audio stream; sub-2-minute clip too short for DAW editing to be plausible.,Tier-1
QeeDraeQwYo,https://youtu.be/QeeDraeQwYo,Gewandhaus Choir – Soundjack Online Rehearsal Recoding 1 (12.2.21),Alexander Carôt,20210213,82,Standard YouTube License,16,NMP-SoundJack,unknown,pending-sprint3,2026-05-17,"Raw unedited count-ins, environmental noise, dry microphone feeds with no spatial processing; typical of a developer test capture.",Tier-1
VJ3TLIFHBGw,https://www.youtube.com/watch?v=VJ3TLIFHBGw,SDS 1st Jamulus Livestream Concert,Six Degree Singers,20210508,2825,Standard YouTube License,30,NMP-Jamulus,unknown,pending-sprint3,2026-05-17,Director discusses server overload mid-concert during live Q&A; one-take livestream framing throughout with no editing claimed.,Tier-1
VlOB9_-08pw,https://www.youtube.com/watch?v=VlOB9_-08pw,384 Panting for Heaven - Philly Sacred Harp Jamulus,Rachel Hall,20210202,141,Standard YouTube License,20,NMP-Jamulus,unknown,pending-sprint3,2026-05-17,Uploaded as a direct Jamulus session capture with no mention of editing; natural Sacred Harp vocal blend without artificial reverb or alignment.,Tier-1
YiUJM6f8YpQ,https://youtu.be/YiUJM6f8YpQ,London City Voices - Jamulus & Zoom rehearsal,London City Voices Choir,20210130,2094,Standard YouTube License,40,NMP-Jamulus,unknown,pending-sprint3,2026-05-17,"Hacker Tier-0 seed (re-confirmed) | Description explicitly states 'This audio is not edited to put everyone in time — this is how it sounded to us'; only global AV sync nudge applied, not vocal comping.",Tier-0
Z-cH7j5iB3k,https://youtu.be/Z-cH7j5iB3k,Here's what zoom choral singing actually sounds like,"St. John's, West Hartford",20210306,45,Standard YouTube License,15,Zoom-only,unknown,pending-sprint3,2026-05-17,Complete rhythmic and harmonic dissolution from Zoom's 150ms+ latency is the entire point of the video; impossible to manufacture via editing.,Tier-1
ZDZ98tl2wAQ,https://youtu.be/ZDZ98tl2wAQ,Sing for Ukraine - Ukraine National Anthem - A cappella,Heléne Blixt,20220308,144,Standard YouTube License,60,NMP-Jamulus,unknown,pending-sprint3,2026-05-17,Minor latency clustering and slight temporal smearing audible where groups of singers drag behind the conductor's pulse; inconsistent with post-produced alignment.,Tier-1
ZKthfLPWBCQ,https://youtu.be/ZKthfLPWBCQ,London City Voices - small group sing Stacy's Mom (Fountains of Wayne) LIVE over Jamulus and Zoom,London City Voices Choir,20210130,208,Standard YouTube License,6,NMP-Jamulus,unknown,pending-sprint3,2026-05-17,Description states 'experiment to see if we could use Jamulus with Zoom for live performance'; occasional audio dropouts confirm real-time unedited capture.,Tier-1
bIDeVGwJQBI,https://www.youtube.com/watch?v=bIDeVGwJQBI,City Choir Spring 2021 Concert - Live Stream,City Choir,20210622,2534,Standard YouTube License,51,NMP-Jamulus,unknown,pending-sprint3,2026-05-17,Jamulus audio feed failed mid-concert causing two songs to be dropped; documented real-time technical failure is impossible to fake in post-production.,Tier-1
bT6B5hjk34M,https://www.youtube.com/watch?v=bT6B5hjk34M,"London City Voices sing ""O Holy Night"" live over Jamulus and Zoom",London City Voices Choir,20211221,210,Standard YouTube License,20,NMP-Jamulus+Zoom,unknown,pending-sprint3,2026-05-17,"Description states 'This was live … What you see and hear is mostly what we saw and heard, with some titles and logo added'; vocal comping explicitly ruled out.",Tier-1
eMCD_pEWpAQ,https://youtu.be/eMCD_pEWpAQ,Jamulus and Zoom singalong with three live instruments and 30 people online,London City Voices Choir,20210228,268,Standard YouTube License,30,NMP-Jamulus+Zoom,unknown,pending-sprint3,2026-05-17,Described as a long unplanned singalong 'not a choir performance at all'; continuous 2.5-hour raw session with acoustic bleed and overlapping banter.,Tier-1
isIV1XsKCgQ,https://youtu.be/isIV1XsKCgQ,"London City Voices singing ""Toxic"" live over Jamulus",London City Voices Choir,20210225,285,Standard YouTube License,45,NMP-Jamulus+Zoom,unknown,pending-sprint3,2026-05-17,Hacker Tier-0 seed (re-confirmed) | Described as a first-time-through demonstration of Jamulus capability; live verbal director feedback audible; raw Jamulus mix published without editing.,Tier-0
jui2O9xfAGo,https://www.youtube.com/watch?v=jui2O9xfAGo,Meeting Places: Singing from Home Edition (Trimmed),i Coristi Chamber Choir,20200531,2480,Standard YouTube License,15,NMP-Jamulus,unknown,pending-sprint3,2026-05-17,Artistic director states only light noise reduction and level adjustment applied post-hoc; real-time improvisation structure rules out comping.,Tier-1
m0B7eYw7oEk,https://youtu.be/m0B7eYw7oEk,Hair Medley (with costumes) NES Online Zoom Choir Rehearsal,Guy Bunce,20200702,497,Standard YouTube License,20,Zoom-only,unknown,pending-sprint3,2026-05-17,Native Zoom cacophony from multiple unmuted participants; no post-production could reproduce the characteristic Zoom smearing without re-recording.,Tier-1
m811fZiPyaQ,https://www.youtube.com/live/m811fZiPyaQ,Jamulus Choral Festival,WorldJam,20200716,4055,Standard YouTube License,40,NMP-Jamulus,unknown,pending-sprint3,2026-05-17,Hacker Tier-0 seed (re-confirmed) | Description explicitly states 'this is not pre-recorded music spliced together … this is REAL. LIVE. MUSIC'; streamed live with spontaneous conductor interactions.,Tier-0
nPRUe91jnPs,https://www.youtube.com/watch?v=nPRUe91jnPs,Conducting a Choir in Jamulus,Jurriaan Grootes,20210128,2967,Standard YouTube License,20,NMP-Jamulus,unknown,pending-sprint3,2026-05-17,Screen-captured Jamulus UI with server jitter and live metronome visible; continuous uninterrupted session capture without any DAW editing.,Tier-1
ouFyQKszE_Y,https://youtu.be/ouFyQKszE_Y,"Soundjack rehearsal Monday, 2021 June 7: Untraveled Worlds",New Jersey Gay Men's Chorus,20221218,71,Standard YouTube License,12,NMP-SoundJack,unknown,pending-sprint3,2026-05-17,Visible discrepancy between facial lip movements and vocal onset in individual tiles confirms impossibility of comped mix.,Tier-1
u7UTcrzQngs,https://www.youtube.com/watch?v=u7UTcrzQngs,Space for Peace Virtual - Live on ZOOM 29th June 2020,Music Centre - University of Winchester,20200707,2124,Standard YouTube License,30,Zoom-only,unknown,pending-sprint3,2026-05-17,"yt-dlp failed: ERROR: [youtube] u7UTcrzQngs: This video is not available | revived 2026-05-19 via yt-dlp player_client=web,android workaround",Tier-1
uO2C6f7iF-M,https://youtu.be/uO2C6f7iF-M,London City Voices - a small group sings Mr Blue Sky by ELO LIVE over Jamulus and Zoom,London City Voices Choir,20210130,295,Standard YouTube License,8,NMP-Jamulus+Zoom,unknown,pending-sprint3,2026-05-17,Positioned as live demonstration rather than polished performance; unquantized entrances and minor phase issues from varying jitter present.,Tier-1
w0ywMP8mOc4,https://youtu.be/w0ywMP8mOc4,And so it goes Jamulus choral festival.,Martin Waugh,20210417,278,Standard YouTube License,24,NMP-Jamulus,unknown,pending-sprint3,2026-05-17,Description states 'unedited as it happened — no stitching together on a computer'; minor network volume imbalances persist.,Tier-1
zOAHHX6A8p0,https://youtu.be/zOAHHX6A8p0,Bell Carol (Arr. by H. Sorenson) – Online Laboratory Choir of the Choir@Home Project,Virtual Choir HQ,20231222,256,Standard YouTube License,34,NMP-SoundJack,unknown,pending-sprint3,2026-05-17,"Project explicitly investigates live online performance using low-latency software; described as a direct SoundJack session capture, not a compiled studio recording.",Tier-1
zp1qLCckgLk,https://youtu.be/zp1qLCckgLk,Karen Richardson appearing on the Jamulus World Jam - Somebody To Love (Queen Cover) 13/06/2020,Strangers To Riches,20200613,533,Standard YouTube License,10,NMP-Jamulus,unknown,pending-sprint3,2026-05-17,Hacker Tier-0 seed (re-confirmed) | Unquantized vocal entrances and real-time backing-track drift audible throughout; raw Jamulus session capture.,Tier-0
VsnvueTan4I,https://www.youtube.com/watch?v=VsnvueTan4I,Our First Virtual Choir Rehearsal using live video chat on ZOOM!,Roanoke Valley Children's Choir,20200407,255,Standard YouTube License,30,Zoom-only,unknown,pending-sprint3,2026-05-19,"Zoom-stratum supplement (Sprint-2 patch): First virtual rehearsal of Roanoke Valley Children's Choir on Zoom, Apr 2020. Raw Zoom audio with uneven entrances.",Tier-1
KJruTaWTWlY,https://www.youtube.com/watch?v=KJruTaWTWlY,What is a Virtual Choir Rehearsal like on ZOOM?? | How To Sing Choir Warm-ups Together Online,Roanoke Valley Children's Choir,20210223,513,Standard YouTube License,25,Zoom-only,unknown,pending-sprint3,2026-05-19,"Zoom-stratum supplement (Sprint-2 patch): Roanoke choir warm-up demo over native Zoom; latency-aware loose alignment, no DAW mix. BORDERLINE (workshop framing in title).",Tier-1
s3ZVr6ki2vw,https://www.youtube.com/watch?v=s3ZVr6ki2vw,Zoom Choir Rehearsal 5.6.2020,Rick McCollum,20200509,2711,Standard YouTube License,35,Zoom-only,unknown,pending-sprint3,2026-05-19,"Zoom-stratum supplement (Sprint-2 patch): Rick McCollum church choir, week 2 Zoom rehearsal, May 2020. 45 min raw capture with talkover, dropouts. OVER 30-MIN LIMIT.",Tier-1
DLdFR7m1thI,https://www.youtube.com/watch?v=DLdFR7m1thI,Zoom Choir Rehearsal 5.27.2020,Rick McCollum,20200528,3026,Standard YouTube License,35,Zoom-only,unknown,pending-sprint3,2026-05-19,"Zoom-stratum supplement (Sprint-2 patch): Rick McCollum church choir, week 4 Zoom rehearsal, May 2020. 50 min with sectional run-throughs, mute issues. OVER 30-MIN LIMIT.",Tier-1
q1rLPIsIPZI,https://www.youtube.com/watch?v=q1rLPIsIPZI,Zoom Choir Rehearsal 6.10.2020,Rick McCollum,20200611,1726,Standard YouTube License,35,Zoom-only,unknown,pending-sprint3,2026-05-19,"Zoom-stratum supplement (Sprint-2 patch): Rick McCollum church choir, week 6 Zoom rehearsal, Jun 2020. 29 min with live accompaniment and mute issues.",Tier-1
